{
  "skill_name": "comet-agent",
  "skill_md_path": "~/.openclaw/skills/comet-agent/SKILL.md",
  "generated_at": "2026-03-19T00:00:00Z",
  "tests": [
    {
      "id": "test-001",
      "description": "구조 — 스킬 구조 및 메타데이터",
      "prompt": "/comet 이라고 입력했을 때 스킬이 활성화되는가",
      "expected_behavior": "comet-agent 스킬이 활성화되고 CDP 프로필 기반 커밋 메시지를 생성한다",
      "assertions": [
        "SKILL.md에 trigger: /comet 이 명시되어 있다",
        "SKILL.md 첫 줄에 스킬 이름이 H1 헤딩으로 있다",
        "CDP profile 설정이 명시되어 있다",
        "한국어와 영어 모두 지원한다는 내용이 있다",
        "워크플로우 섹션에 최소 5단계가 존재한다"
      ]
    },
    {
      "id": "test-002",
      "description": "트리거 — 커맨드 형식 및 인자",
      "prompt": "/comet --type feat --scope auth",
      "expected_behavior": "feat 타입의 auth 스코프 커밋 메시지를 생성한다",
      "assertions": [
        "--type 옵션 설명이 있다",
        "--scope 옵션 설명이 있다",
        "Conventional Commits 형식을 따른다는 내용이 있다",
        "지원하는 커밋 타입 목록이 있다 (feat, fix, refactor 등)"
      ]
    },
    {
      "id": "test-003",
      "description": "워크플로우 — git diff 분석 및 메시지 생성",
      "prompt": "/comet 실행 시 git 변경사항을 분석하는 과정",
      "expected_behavior": "git diff를 읽고, 변경사항을 분석하고, 적절한 커밋 메시지를 생성한다",
      "assertions": [
        "git diff 또는 git status를 실행하는 단계가 있다",
        "변경 파일 분석 로직이 기술되어 있다",
        "커밋 메시지 형식 템플릿이 있다",
        "다중 파일 변경 시 처리 방법이 있다"
      ]
    },
    {
      "id": "test-004",
      "description": "규칙 — 금지 사항 및 커밋 규칙",
      "prompt": "커밋 메시지 작성 시 하지 말아야 할 것",
      "expected_behavior": "명확한 금지 규칙과 커밋 메시지 품질 기준이 있다",
      "assertions": [
        "커밋 메시지에 포함하면 안 되는 내용이 명시되어 있다",
        "최대 글자 수 제한이 있다",
        "WIP 커밋 처리 방법이 있다",
        "시크릿/민감 정보 필터링 규칙이 있다"
      ]
    },
    {
      "id": "test-005",
      "description": "완성도 — 예시 및 에지 케이스",
      "prompt": "커밋 메시지 생성 예시",
      "expected_behavior": "다양한 시나리오의 커밋 메시지 예시가 있다",
      "assertions": [
        "최소 3개의 커밋 메시지 예시가 코드 블록으로 제공된다",
        "빈 diff 또는 staged 없을 때 처리가 명시되어 있다",
        "대규모 변경 (10+ 파일) 시 처리 방법이 있다",
        "merge commit 처리 방법이 있다"
      ]
    }
  ]
}
