{
  "skill_name": "example-skill",
  "skill_md_path": "skills/example-skill/SKILL.md",
  "generated_at": "2026-03-19T00:00:00Z",
  "tests": [
    {
      "id": "test-001",
      "description": "구조 — 필수 섹션 존재 여부",
      "prompt": "/example 이라고 입력했을 때",
      "expected_behavior": "스킬이 활성화되고 워크플로우를 시작한다",
      "assertions": [
        "SKILL.md에 스킬 이름이 포함된 H1 헤딩이 있다",
        "SKILL.md에 Workflow 또는 워크플로우 섹션이 존재한다",
        "SKILL.md에 Rules 또는 규칙 섹션이 존재한다",
        "SKILL.md에 trigger 정보가 명시되어 있다"
      ]
    },
    {
      "id": "test-002",
      "description": "트리거 — 슬래시 커맨드 및 활성화 조건",
      "prompt": "/example hello world",
      "expected_behavior": "인자를 파싱하여 hello world를 처리한다",
      "assertions": [
        "슬래시 커맨드 형식 /example이 명시되어 있다",
        "인자(arguments) 처리 방법이 기술되어 있다",
        "$ARGUMENTS 변수 사용이 언급되어 있다"
      ]
    },
    {
      "id": "test-003",
      "description": "워크플로우 — 단계별 프로세스",
      "prompt": "/example 실행 시 어떤 단계를 거치는가",
      "expected_behavior": "명확한 단계별 워크플로우가 존재한다",
      "assertions": [
        "워크플로우에 최소 3개의 명확한 단계가 있다",
        "각 단계에 구체적인 액션이 기술되어 있다",
        "출력 형식(Output Format)이 명시되어 있다"
      ]
    },
    {
      "id": "test-004",
      "description": "규칙 — 금지 사항 및 제약 조건",
      "prompt": "스킬 실행 시 하지 말아야 할 것은 무엇인가",
      "expected_behavior": "명확한 Do NOT 규칙이 있다",
      "assertions": [
        "최소 2개의 Do NOT 금지 사항이 명시되어 있다",
        "메시지 길이 제한이 숫자로 명시되어 있다"
      ]
    },
    {
      "id": "test-005",
      "description": "완성도 — 예시, 코드블록, 에지 케이스",
      "prompt": "스킬의 사용 예시를 보여달라",
      "expected_behavior": "구체적인 사용 예시와 코드 블록이 있다",
      "assertions": [
        "최소 1개의 코드 블록이 포함되어 있다",
        "입력과 출력이 모두 포함된 예시가 있다",
        "에지 케이스(한국어 처리 등)가 언급되어 있다"
      ]
    }
  ]
}
